{
  "name": "Andre Castillo",
  "company": "Verde Holdings Group",
  "position": "Business Development Manager",
  "phone": [
    "+63 999 321 7654"
  ],
  "email": [
    "andre.c@verdeholdings.ph"
  ],
  "address": "Head Office: Cebu Business Park",
  "notes": "facebook.com/verdeholdings",
  "_meta": {
    "id": "card-021-holdings-group",
    "difficulty": "easy",
    "tags": [
      "ph"
    ]
  }
}
