{
  "name": "Dr. John Lee, MD",
  "company": "Health First Inc.",
  "position": "Medical Director",
  "phone": ["+63 2 8888 9999", "0917-222-3333", "8362-5820 (Fax)"],
  "email": ["jlee@healthfirst.ph", "appointments@healthfirst.ph"],
  "address": "Quezon City, Metro Manila",
  "notes": "linkedin.com/in/johnlee-md",
  "_meta": {
    "id": "card-002-multi-phone",
    "difficulty": "medium",
    "tags": ["multi-phone", "fax", "multi-email", "credentials", "ph"],
    "notes": "Three phone lines (office, mobile, fax). Two emails."
  }
}
