{
  "name": "Diego Flores",
  "company": "Flores Family Farms",
  "position": "",
  "phone": [
    "0919-222-3333"
  ],
  "email": [
    "diego@floresfarms.ph"
  ],
  "address": "Batangas",
  "notes": "Organic produce",
  "_meta": {
    "id": "card-014-no-position",
    "difficulty": "easy",
    "tags": [
      "partial-fields",
      "ph"
    ]
  }
}
