{
  "name": "Lourdes Pineda",
  "company": "Pineda Dental Clinic",
  "position": "Clinic Administrator",
  "phone": [
    "02-8899-3344",
    "0918-200-3000"
  ],
  "email": [
    "info@pinedadental.ph"
  ],
  "address": "San Juan City",
  "notes": "",
  "_meta": {
    "id": "card-020-comma-phones",
    "difficulty": "medium",
    "tags": [
      "multi-phone",
      "ph"
    ],
    "notes": "Phones comma-separated on one line."
  }
}
