{
  "name": "Roberto Santos III",
  "company": "Santos Realty Corporation",
  "position": "Broker",
  "phone": [
    "+63 922 333 4444"
  ],
  "email": [
    "rsantos3@santosrealty.ph"
  ],
  "address": "Main Office: Quezon City | Branch: Antipolo",
  "notes": "",
  "_meta": {
    "id": "card-025-iii-suffix",
    "difficulty": "medium",
    "tags": [
      "credentials",
      "stacked-logo",
      "multi-address",
      "ph"
    ]
  }
}
