[
  {
    "name": "Maria Santos",
    "company": "Acme Corp",
    "position": "Sales Manager",
    "phone": [
      "+63 917 555 1234"
    ],
    "email": [
      "maria.santos@acme.com"
    ],
    "address": "Makati City",
    "notes": "Booth interest"
  },
  {
    "name": "Dr. John Lee, MD",
    "company": "Health First Inc.",
    "position": "Medical Director",
    "phone": [
      "+63 2 8888 9999",
      "0917-222-3333"
    ],
    "email": [
      "jlee@healthfirst.ph"
    ],
    "address": "Quezon City",
    "notes": ""
  },
  {
    "name": "Ana Reyes",
    "company": "KINMO PW Corporation",
    "position": "Procurement Lead",
    "phone": [
      "0918-777-8888"
    ],
    "email": [
      "ana.reyes@kinmopw.com"
    ],
    "address": "Taguig",
    "notes": "Follow up next week"
  }
]
