{
  "name": "Wei Chen",
  "company": "Apex Trade Pte Ltd",
  "position": "Regional Director",
  "phone": [
    "+65 6123 4567",
    "+63 917 900 8000"
  ],
  "email": [
    "wei.chen@apextrade.com"
  ],
  "address": "BGC Office: Taguig",
  "notes": "www.apextrade.com",
  "_meta": {
    "id": "card-018-pte-style",
    "difficulty": "medium",
    "tags": [
      "multi-phone",
      "ph",
      "intl"
    ]
  }
}
